{
  "schema_version": "lesson-presentation/v1",
  "presentation_id": "presentation-shangyang-l105",
  "course_id": "C-prequin-state",
  "lesson_id": "L105",
  "presentation_version": 1,
  "status": "sealed",
  "title": "商鞅变法：材料年代与制度代价导读",
  "estimated_minutes": 40,
  "phase_minutes": {
    "observe": 9,
    "decide": 14,
    "consult": 7,
    "dossier": 10
  },
  "video_path": "media/lessons/L105/v001/shangyang-intro.mp4",
  "poster_path": "media/lessons/L105/v001/shangyang-poster.webp",
  "transcript_path": "media/lessons/L105/v001/shangyang-transcript.md",
  "video_duration_seconds": 45.0,
  "video_width": 1920,
  "video_height": 1080,
  "video_fps": 30,
  "video_sha256": "f03debeaced13dc80b272800c5f239f670f5c76846f3d86acbfc6f093fa35c71",
  "poster_sha256": "133b330d981380af11d322453fb3a6c5ebadefac9acb2df53fb6635f05820a57",
  "transcript_sha256": "1a684f351fea9e6adb3da1ce3833626ea5cef620ba8f16813c006b86931f63e6",
  "skip_allowed": true,
  "accessibility_note": "无声 HyperFrames 中文动画；全部关键信息写入画面并提供本地 Markdown 文字稿，学生可随时跳过。",
  "sealed_at": "2026-10-10T22:25:52.468129Z",
  "sealed_by": "teaching-alignment-technical-reviewer",
  "checksum": "9dec321c83b6326c115515b28167f37515b8fb3da903b2e85636377d3adc5920"
}
